,json_Privacy_think,Topic,Privacy_think_topics
14,User is concerned about data privacy when using AI,0,Label: Data Privacy Concerns
27,Potential privacy concerns due to collection and storage of customer data,0,Label: Data Privacy Concerns
28,User appreciates that chatbot does not share their data without consent,3,Label: Chatbot Privacy
36,User mentions the tool's ability to protect their data and privacy,2,Label: Data Privacy and Security
68,The chatbot respects user privacy by not asking for unnecessary personal information.,3,Label: Chatbot Privacy
80,"User mentions the need to safely capture information from interested parties while weeding out spammers, highlighting privacy concerns",0,Label: Data Privacy Concerns
88,Company takes privacy seriously and implements measures to protect user data,6,Label: Privacy and Data Protection
91," The chatbot is designed to protect customer privacy by only collecting necessary information and deleting it after use,",3,Label: Chatbot Privacy
94,User notes the platform's ability to collect email addresses for lead segmentation and monitoring without compromising privacy,5,Label: Privacy-focused lead generation
105,"User notes that the tool is cost-effective and easily customizable, which suggests a high level of privacy concern",0,Label: Data Privacy Concerns
106,"User provides no privacy concerns, indicating a responsible handling of customer data",5,Label: Privacy-focused lead generation
109,User is comfortable with the chatbot collecting and using their data,3,Label: Chatbot Privacy
110,User is aware of data collection and handling practices,1,Label: Privacy and Security Awareness
116," User data is protected through secure coding practices and GDPR compliance,",4,Label: Data Privacy and Security
118," User is satisfied that the bot protects customer data and privacy,",4,Label: Data Privacy and Security
128,Chatbot collects visitor data but does not share it without consent,3,Label: Chatbot Privacy
131," While the tool does collect some visitor data, it is not excessive and is used solely for lead generation purposes,",5,Label: Privacy-focused lead generation
134,User is concerned about data privacy and security,0,Label: Data Privacy Concerns
136,"Reviewer notes that while the service provides real-time updates on website visitors, they do not disclose any personal information without consent.",5,Label: Privacy-focused lead generation
138,User is comfortable with platform collecting and using their data,4,Label: Data Privacy and Security
143,User notes that the tool protects customer data and privacy,2,Label: Data Privacy and Security
158,"User mentions that the tool is easy for end-users to adopt, which increases privacy protections",2,Label: Data Privacy and Security
166,User raises concerns about the tool's ability to collect and use customer data without proper transparency and consent.,0,Label: Data Privacy Concerns
177,Concerns about data privacy and security when integrating with external systems,0,Label: Data Privacy Concerns
206," User acknowledges the importance of privacy when using the tool,",1,Label: Privacy and Security Awareness
208,"User acknowledges importance of privacy, highlighting platform's commitment to protecting sensitive information",1,Label: Privacy and Security Awareness
216,User acknowledges privacy concerns but no details provided,1,Label: Privacy and Security Awareness
219,User acknowledges the importance of privacy and security in the platform's design,1,Label: Privacy and Security Awareness
223," User highlights the tool's ability to protect user data and ensure security,",2,Label: Data Privacy and Security
228,The platform's ability to handle sensitive financial information securely and efficiently demonstrates a strong commitment to privacy and data protection.,4,Label: Data Privacy and Security
236,User mentions the importance of privacy when using chatbot for lead generation,7,Label: Privacy in Chatbot Development
246,User mentions ability to find privacy settings and control data usage,0,Label: Data Privacy Concerns
266," User acknowledges the importance of privacy and notes that the tool does not collect unnecessary information,",5,Label: Privacy-focused lead generation
275,Concerns about data privacy and security,0,Label: Data Privacy Concerns
283,User mentions the tool's ability to handle sensitive information securely and protect user privacy.,2,Label: Data Privacy and Security
286,User mentions the importance of privacy and security in the chatbot's functionality,7,Label: Privacy in Chatbot Development
288," User acknowledges the tool's commitment to protecting user data and privacy,",1,Label: Privacy and Security Awareness
294,"User expresses concern about privacy, wanting more control over what the chatbot knows and does",7,Label: Privacy in Chatbot Development
299,User mentions importance of privacy when handling customer data,1,Label: Privacy and Security Awareness
303,User is concerned about the privacy of their data and the security of their AI bot's training data,0,Label: Data Privacy Concerns
305,User has taken steps to protect client data and privacy,1,Label: Privacy and Security Awareness
307,User mentions concern about database capacity and storage,0,Label: Data Privacy Concerns
311,"The chatbot collects data for improved customer support, but users are informed of data handling practices and have control over their data.",3,Label: Chatbot Privacy
322,User is concerned about privacy and data security,0,Label: Data Privacy Concerns
326,User mentions privacy concerns related to customer data handling,0,Label: Data Privacy Concerns
335,"The tool takes necessary measures to protect user data and ensure privacy, such as encryption and secure storage.",2,Label: Data Privacy and Security
350,"Intercom takes privacy seriously, ensuring that customer data is secure and handled responsibly.",6,Label: Privacy and Data Protection
353,User mentions the tool's ability to handle sensitive customer data securely,2,Label: Data Privacy and Security
357,User is concerned about data privacy when using the app,0,Label: Data Privacy Concerns
368,"The platform takes privacy seriously, collecting only necessary data to provide personalized experiences and ensuring its secure storage and protection.",1,Label: Privacy and Security Awareness
371,The chatbot protects customer privacy by only sharing necessary information and adhering to data protection policies.,3,Label: Chatbot Privacy
383,"User notes that the chatbot does not share their information with third parties, ensuring privacy",3,Label: Chatbot Privacy
390,Chatbot collects customer data but maintains privacy,3,Label: Chatbot Privacy
397,User raises privacy concerns regarding the AI assistant's ability to collect and store data,0,Label: Data Privacy Concerns
398,User mentions that their data is secure and protected,4,Label: Data Privacy and Security
418,User mentions importance of privacy and security,1,Label: Privacy and Security Awareness
430," Tool collects user data for training and improvement purposes,",2,Label: Data Privacy and Security
442,"User mentions the tool's knowledge base being powerful, but does not provide any privacy considerations.",5,Label: Privacy-focused lead generation
446,User raises concern about data privacy and security when deploying the tool across multiple channels,0,Label: Data Privacy Concerns
447,Users feel secure knowing their data is protected,4,Label: Data Privacy and Security
451,User raises concern over GenAI tool's handling of sensitive data,0,Label: Data Privacy Concerns
453,Implementation includes measures to protect user data privacy,6,Label: Privacy and Data Protection
468," Company takes privacy seriously and implements measures to protect client data,",6,Label: Privacy and Data Protection
507,Properly handling sensitive information and providing necessary security measures,6,Label: Privacy and Data Protection
509," User mentions need for privacy controls and data protection,",0,Label: Data Privacy Concerns
513,"User data is protected and securely handled, ensuring privacy and confidentiality.",4,Label: Data Privacy and Security
521,User acknowledges importance of privacy and security in AI-powered solutions,1,Label: Privacy and Security Awareness
530,User raises concern about data privacy and security,0,Label: Data Privacy Concerns
531,Appropriate data handling practices in place,6,Label: Privacy and Data Protection
540,Integration with CRM systems protects sensitive customer data,6,Label: Privacy and Data Protection
545,"Platform takes privacy seriously, with measures in place to protect user data and ensure GDPR compliance.",6,Label: Privacy and Data Protection
551,"User expresses concern about API calls having longer than 20-second timeouts, raising privacy concerns.",0,Label: Data Privacy Concerns
552,Concerns about data privacy and security during chatbot development and integration,7,Label: Privacy in Chatbot Development
554," User mentions need for privacy controls and data protection,",0,Label: Data Privacy Concerns
559,User mentions the platform's ability to connect with various systems and databases without compromising privacy,5,Label: Privacy-focused lead generation
566,"User data is protected through secure channels, ensuring privacy compliance.",4,Label: Data Privacy and Security
578,User acknowledges importance of privacy and security in AI-powered solutions,1,Label: Privacy and Security Awareness
603,User is concerned about privacy during bot development,7,Label: Privacy in Chatbot Development
619,User notes that documentation is outdated and community support is still developing,2,Label: Data Privacy and Security
637,User mentions that the chatbot does not collect or store any personal information,3,Label: Chatbot Privacy
642,User raises concern over chatbot's potential to serve outdated or incorrect articles,7,Label: Privacy in Chatbot Development
645,"The chatbot may collect and store user data, raising concerns about privacy and data protection.",7,Label: Privacy in Chatbot Development
648," The tool collects and analyzes user data, raising concerns about privacy and data protection,",0,Label: Data Privacy Concerns
650,User is concerned about data privacy when using the GenAI tool,0,Label: Data Privacy Concerns
670," User mentions that the tool tracks customer data but does not express any concerns about privacy violations,",5,Label: Privacy-focused lead generation
672,Privacy concerns addressed through secure communication channels,4,Label: Data Privacy and Security
676," User mentions that the tool tracks customer data but does not express any concerns about privacy violations,",5,Label: Privacy-focused lead generation
678,User acknowledges privacy concerns,1,Label: Privacy and Security Awareness
685,User mentions the tool's ability to protect their customers' privacy,2,Label: Data Privacy and Security
695," User acknowledges the tool's ability to protect customer data and privacy,",1,Label: Privacy and Security Awareness
708," The chatbot collects customer data, which raises privacy concerns,",7,Label: Privacy in Chatbot Development
723,"User mentions the bot's ability to check user accounts, subscribe statuses, and gather necessary information while adhering to strict data privacy regulations.",1,Label: Privacy and Security Awareness
731,"The tool collects and processes lead data, raising concerns about privacy and data protection. Ensure proper security measures are in place.",2,Label: Data Privacy and Security
