,CustomName,Representation,Count,Representative_Docs
0,Label: Ethical Chatbot Development,"['chatbot', 'ethical', 'user', 'considerations', 'ethical considerations', 'the', 'and', 'in', 'of', 'ethical considerations in']",92,"['User acknowledges the importance of ethical considerations in chatbot development', 'User acknowledges the importance of ethical considerations in chatbot development.', 'User acknowledges the importance of ethical considerations in chatbot development']"
1,Label: Ethical AI Development,"['ai', 'of', 'the', 'ethical', 'user', 'considerations', 'ethical considerations', 'in', 'acknowledges', 'user acknowledges']",82,"['User acknowledges the importance of ethical considerations in AI development', 'User acknowledges the importance of ethical considerations in AI development', 'User acknowledges the importance of ethical considerations in AI development']"
2,Label: Ethical Tool Satisfaction,"['tool', 'the', 'the tool', 'ethical', 'user', 'and', 'considerations', 'ethical considerations', 'expresses', 'tool ethical']",79,"[""User expresses satisfaction with the tool's ethical considerations"", ""User expresses satisfaction with the tool's ethical considerations"", ""User expresses satisfaction with the tool's ethical considerations""]"
3,Label: Ethical Considerations User Acknowledgments,"['ethical', 'ethical considerations', 'considerations', 'user', 'user acknowledges ethical', 'user acknowledges ethical considerations', 'acknowledges ethical considerations', 'acknowledges ethical', 'acknowledges', 'user acknowledges']",73,"['User acknowledges ethical considerations', 'User acknowledges ethical considerations', 'User acknowledges ethical considerations']"
4,Label: Ethical Considerations in Personal Data Handling,"['user raises', 'user raises ethical', 'raises ethical', 'raises', 'user', 'ethical', 'user raises ethical considerations', 'raises ethical considerations', 'about', 'user raises ethical considerations related']",36,"['User raises ethical considerations related to personal data handling', 'User raises ethical considerations related to personal data handling', 'User raises ethical considerations']"
5,Label: Ethical Considerations in User Acknowledgement,"['concerns', 'does not raise', 'not raise', 'does', 'does not', 'not', 'raise', 'any', 'not raise any', 'does not raise any']",24,"['User acknowledges ethical considerations but does not raise any concerns', 'User acknowledges ethical considerations but does not raise any concerns', 'User acknowledges ethical considerations but does not raise any concerns']"
6,Label: Ethical Considerations in AI,"['user raises ethical', 'user raises', 'raises ethical', 'raises', 'ai', 'about', 'ethical concerns about', 'concerns about', 'ethical', 'ethical concerns']",22,"['User raises ethical concerns about the use of AI in issue resolution', 'User raises ethical concerns about the use of AI in chatbots', 'User raises ethical concerns about the use of AI in customer support']"
7,Label: Customer Support Lead Generation,"['user', 'ability to', 'ability', 'tool ability to', 'tool ability', 'tool', 'the', 'and', 'to', 'the tool ability to']",21,"[""User highlights the tool's ease of use and customization options"", ""User expresses satisfaction with the tool's ability to solve two main problems: connecting with clients and capturing leads."", ""User expresses satisfaction with the tool's ability to help account managers find sales information from their database in an easy and conversational manner.""]"
